{
  "$schema": "https://json-schema.org/draft/2020-12/schema",
  "$id": "https://github.com/kyashrathore/agent-app-benchmark/schemas/comparison-v1.schema.json",
  "title": "Agent app benchmark comparison manifest v1",
  "type": "object",
  "additionalProperties": false,
  "required": [
    "schemaVersion",
    "id",
    "title",
    "provenance",
    "results"
  ],
  "properties": {
    "schemaVersion": {
      "const": 1
    },
    "id": {
      "type": "string",
      "pattern": "^[a-z0-9][a-z0-9-]*$"
    },
    "title": {
      "type": "string",
      "minLength": 1,
      "maxLength": 200
    },
    "description": {
      "type": "string",
      "maxLength": 2000
    },
    "provenance": {
      "enum": [
        "maintainer-observed",
        "community-self-attested"
      ]
    },
    "results": {
      "type": "array",
      "minItems": 1,
      "items": {
        "type": "object",
        "additionalProperties": false,
        "required": [
          "appId",
          "scenarioId",
          "path",
          "digestSha256"
        ],
        "properties": {
          "appId": {
            "type": "string",
            "pattern": "^[a-z][a-z0-9-]*$"
          },
          "scenarioId": {
            "type": "string",
            "pattern": "^[a-z][a-z0-9-]*-v[1-9][0-9]*$"
          },
          "path": {
            "type": "string",
            "minLength": 1
          },
          "digestSha256": {
            "type": "string",
            "pattern": "^[0-9a-f]{64}$"
          }
        }
      }
    },
    "policy": {
      "enum": [
        "balanced-mirrored",
        "independent-runs"
      ]
    }
  }
}
