{
  "schemaVersion": 1,
  "id": "initial-macos-arm64",
  "title": "T3 Code and Claxedo on Apple M4 Pro",
  "description": "Maintainer-observed smoke-profile comparison of completed historical GUI sessions on the same macOS arm64 machine. Invalid observations remain visible and are never replaced with scores.",
  "provenance": "maintainer-observed",
  "results": [
    {
      "appId": "t3",
      "scenarioId": "app-start-v1",
      "path": "runs/t3/app-start-v1/result.json",
      "digestSha256": "ef8a75d389769e97c4bbec8984b47e2a955b4f83384d120e0dfff09eaa24ad17"
    },
    {
      "appId": "claxedo",
      "scenarioId": "app-start-v1",
      "path": "runs/claxedo/app-start-v1/result.json",
      "digestSha256": "f9d21fe5aa53b3764997c4d10f4e462f33b7cb2fc24842119dcaf45b403048fa"
    },
    {
      "appId": "claxedo",
      "scenarioId": "session-switch-v1",
      "path": "runs/claxedo/session-switch-v1/result.json",
      "digestSha256": "45d9ba13a987360230db215dbd014f0af14fa606767a4a3bca4dc3870f533640"
    },
    {
      "appId": "t3",
      "scenarioId": "session-switch-v1",
      "path": "runs/t3/session-switch-v1/result.json",
      "digestSha256": "0fd303a8409f019e5574ab6ae4ffdff18f40f60f4d290084187796ace890616d"
    }
  ]
}
